{
  "schema_version": "1.0",
  "receipt_type": "FOX2_PREEXEC_RECEIPT",
  "project": "FOX2",
  "wp_id": "FOX2-BRIDGE-RC1-TO-INTERNAL-READY",
  "checked_at": "2026-10-22T10:07:35.5994016Z",
  "task_branch": "work/FOX2-BRIDGE-RC1-PRESENTATION-LOCK-CERTIFIER-REWORK-R4-20261022",
  "receipt_path": "reports/FOX2-BRIDGE-RC1-TO-INTERNAL-READY/preexec/presentation_lock_certifier_rework_r4.json",
  "source_head": "b9e1255b0e728b33c6e400465255214738fb2a6e",
  "task_source": {
    "git_path": "docs/agent_handoff/FOX2-BRIDGE-RC1-TO-INTERNAL-READY/presentation_lock_certifier_rework_r4/task.md",
    "git_commit_sha": "6b6cc697ca35b35ade1ccdf363782a1f912a8936",
    "sha256": "54c2075c0cce6faa90c4f23292ebe43f90e28c356089f4cbbe1e245b9a257456"
  },
  "status": "PASS",
  "capabilities": {
    "source_binding": {
      "status": "PASS",
      "material": true,
      "evidence": "accepted_source=085cc8302e824dbccf9cbef80422ed48894b9cb4; publication=b9e1255b0e728b33c6e400465255214738fb2a6e"
    },
    "route_assessment_binding": {
      "status": "PASS",
      "material": true,
      "evidence": "COMPLEXITY=MEDIUM; EXECUTION_RISK=MEDIUM; SAFETY_OVERRIDE=NO; selected CODEX/gpt-6.1-sol/medium"
    },
    "selected_route_verification": {
      "status": "PASS",
      "material": true,
      "version": "codex-cli 0.162.1",
      "executable": "C:\\Users\\Fox Le\\AppData\\Local\\Programs\\OpenAI\\Codex\\bin\\codex.exe",
      "exit_code": 0,
      "evidence": "Fresh gpt-6.1-sol/medium read-only capacity probe PASS"
    },
    "test_python": {
      "status": "PASS",
      "material": true,
      "version": "Python 3.13; pytest 8.3.5; jsonschema 4.26.0",
      "executable": "USERLOCAL/Programs/Python/Python313/python.exe",
      "evidence": "Fresh current existing Python test runner capability PASS; no install/upgrade"
    },
    "certifier_source_binding": {
      "status": "PASS",
      "material": true,
      "evidence": "certifier_blob=7e62103ea4876833f67794a927a2a54622a59ea5; test_blob=f80e50d59b1f1bb9ec9d553e84bbe7948971cb66"
    },
    "task_prompt_binding": {
      "status": "PASS",
      "material": true,
      "evidence": "task_sha256=54c2075c0cce6faa90c4f23292ebe43f90e28c356089f4cbbe1e245b9a257456; prompt_sha256=bc10a5f348fbe8a5348db9159f93820841b8044bd5e4eb644093b892ea79b253"
    },
    "recovery_binding": {
      "status": "PASS",
      "material": true,
      "evidence": "R3_A01_CONSUMED_NO_RESULT_NO_REPLAY=3c32743e9b9cdcb7eb799094ee7bdefdaeb9aa71"
    },
    "reuse_plan_binding": {
      "status": "PASS",
      "material": true,
      "evidence": "master_plan=ad7d6f0b9889fe4247c29ac3d77f0b90b5f40e56; reuse_plan=da6fd27d78380db42fce155d634044c94a661229; v037_review=7cee0933ffd241deaa8e748bfeb626c56fab0cd0"
    },
    "governance_source": {
      "status": "PASS",
      "material": true,
      "evidence": "Current Registry/Resolution/Dictionary/Policy/Routing/Protocol/ReceiptSchema/DispatchSchema blobs verified"
    },
    "worktree_clean": {
      "status": "PASS",
      "material": true,
      "evidence": "Dedicated R4 worktree clean; zero agent_bridge drift before coding"
    },
    "one_writer": {
      "status": "PASS",
      "material": true,
      "evidence": "No R4 task-scoped CODEX writer observed"
    },
    "codex_cli": {
      "status": "PASS",
      "material": true,
      "version": "codex-cli 0.162.1",
      "executable": "C:\\Users\\Fox Le\\AppData\\Local\\Programs\\OpenAI\\Codex\\bin\\codex.exe",
      "evidence": "Pinned CODEX CLI verified"
    },
    "git_push_permission": {
      "status": "PASS",
      "material": true,
      "executable": "C:\\Program Files\\Git\\cmd\\git.exe",
      "evidence": "Authorized R4 branch push dry-run PASS"
    },
    "no_replay": {
      "status": "PASS",
      "material": true,
      "evidence": "Consumed R3 Dispatch remains historical; fresh R4 Dispatch absent"
    },
    "host_lifecycle_isolation": {
      "status": "PASS",
      "material": true,
      "evidence": "R4 certifier-only correction; no package build/install/host lifecycle/A05/G3/G4/Canary"
    }
  },
  "blockers": [],
  "worktree": {
    "status": "PASS",
    "path": "C:\\Projects\\FOX2-worktrees\\FOX2-BRIDGE-RC1-PRESENTATION-LOCK-CERTIFIER-REWORK-R4-20261022",
    "competing_writer": "NONE_OBSERVED",
    "stale_receipt_cleanup": "NOT_NEEDED"
  },
  "candidate_route": {
    "product": "CODEX",
    "model_policy": "PINNED",
    "model": "gpt-6.1-sol",
    "reasoning_effort": "medium",
    "permission_profile": "FULL_ACCESS"
  },
  "dispatch_state": {
    "executable_dispatch_published": false,
    "dispatch_consumed": false
  },
  "agent_execution_started": false,
  "notes": [
    "R4 is a fresh attempt after R3 A01 CONSUMED_NO_RESULT; R3 Dispatch is no-replay.",
    "Unchanged A04/R3 PASS evidence is reused; only new-attempt/time-dependent gates were rechecked.",
    "FOX2 Skills v0.3.7 route assessment selected Medium before PreExec.",
    "PreExec verifies the selected Medium route and does not classify complexity.",
    "No package build/install/host lifecycle/A05/G3/G4/Canary authority.",
    "Receipt is validated against current Receipt Schema v1 before publication.",
    "PASS permits CHAT intake and one fresh R4 coding Dispatch only."
  ]
}
