{
  "schema_version": "1.0",
  "receipt_type": "FOX2_PREEXEC_RECEIPT",
  "project": "FOX2",
  "wp_id": "FOX2-PREEXEC-ROLLOUT-V1",
  "checked_at": "2026-10-14T17:53:35.0177599+07:00",
  "task_branch": "work/FOX2-PREEXEC-ROLLOUT-V1",
  "receipt_path": "reports/FOX2-PREEXEC-ROLLOUT-V1/preexec/local_preflight.json",
  "source_head": "b0825e94cbbb9494dd042fd49daec7b8e34c93c6",
  "task_source": {
    "git_path": "docs/agent_handoff/FOX2-PREEXEC-ROLLOUT-V1/task.md",
    "git_commit_sha": "b0825e94cbbb9494dd042fd49daec7b8e34c93c6",
    "sha256": "8ac194e6ef4321b500c67b5ae918d357567e7958f83fe415b29439c08d5bac53"
  },
  "status": "PASS",
  "capabilities": {
    "git": {
      "status": "PASS",
      "material": true,
      "version": "git version 2.56.0.windows.1",
      "executable": "C:\\Program Files\\Git\\cmd\\git.exe",
      "exit_code": 0,
      "failure_class": "",
      "evidence": "required rollout host tool available"
    },
    "python": {
      "status": "PASS",
      "material": true,
      "version": "Python 3.13.15",
      "executable": "C:\\Users\\Fox Le\\AppData\\Local\\Programs\\Python\\Python313\\python.exe",
      "exit_code": 0,
      "failure_class": "",
      "evidence": "required rollout host tool available"
    },
    "pwsh": {
      "status": "PASS",
      "material": true,
      "version": "7.6.6",
      "executable": "C:\\Program Files\\PowerShell\\7\\pwsh.exe",
      "exit_code": 0,
      "failure_class": "",
      "evidence": "required rollout host tool available"
    },
    "copilot": {
      "status": "FAIL",
      "material": true,
      "version": "GitHub Copilot CLI 1.0.97.\r\nRun 'copilot update' to check for updates.",
      "executable": "C:\\Users\\Fox Le\\AppData\\Local\\Microsoft\\WinGet\\Packages\\GitHub.Copilot_Microsoft.Winget.Source_8wekyb3d8bbwe\\copilot.exe",
      "exit_code": 1,
      "failure_class": "AUTH_REQUIRED",
      "evidence": "minimal no-write FULL_ACCESS probe failed; raw output not persisted"
    },
    "codex": {
      "status": "PASS",
      "material": true,
      "version": "codex-cli 0.162.1",
      "executable": "C:\\Users\\Fox Le\\AppData\\Local\\Programs\\OpenAI\\Codex\\bin\\codex.exe",
      "exit_code": 0,
      "failure_class": "",
      "evidence": "minimal no-write PINNED/FULL_ACCESS probe returned expected marker"
    }
  },
  "blockers": [],
  "worktree": {
    "status": "PASS",
    "path": "C:\\Projects\\FOX2-worktrees\\FOX2-PREEXEC-ROLLOUT-V1",
    "competing_writer": "NONE_OBSERVED",
    "stale_receipt_cleanup": "SAFE_ONLY"
  },
  "candidate_route": {
    "product": "CODEX",
    "model_policy": "PINNED",
    "model": "gpt-6.1-sol",
    "auto_tier": null,
    "reasoning_effort": "medium",
    "permission_profile": "FULL_ACCESS"
  },
  "dispatch_state": {
    "executable_dispatch_published": false,
    "dispatch_consumed": false
  },
  "agent_execution_started": false,
  "notes": [
    "Preflight only; no implementation Agent was started.",
    "Candidate route is advisory evidence until CHAT remote intake.",
    "Raw Agent probe output is intentionally not persisted."
  ]
}
